{
    "id": "c92d4d0e-4404-4b9e-92ee-75a7e25e126a",
    "name": "decimate-unwrap",
    "description": "Decimate mesh and generate UV coordinates",
    "version": "1",
    "start": "pickup",

    "parameterSchema": {
        "type": "object",
        "properties": {
            "sourceMeshFile": {
                "type": "string",
                "minLength": 1,
                "format": "file"
            },
            "outputFileBaseName": {
                "type": "string",
                "minLength": 1
            },
            "numFaces": {
                "type": "integer",
                "minimum": 100,
                "default": 150000
            },
            "cleanupMesh": {
                "type": "boolean",
                "default": true
            },
            "inspectMesh": {
                "type": "boolean",
                "default": false
            }
        },
        "required": [
            "sourceMeshFile"
        ],
        "additionalProperties": false
    },

    "steps": {
        "pickup": {
            "task": "Pickup",
            "description": "Fetch input files from client",
            "pre": {
                "outputFileBaseName": "$baseName($firstTrue(outputFileBaseName, sourceMeshFile))",
                "baseMeshName": "$baseMeshName($firstTrue(outputFileBaseName, sourceMeshFile), numFaces)",
                "baseMeshMapName": "$baseMeshMapName($firstTrue(outputFileBaseName, sourceMeshFile), numFaces, mapSize)"
            },
            "parameters": {
                "method": "transportMethod",
                "path": "$firstTrue(pickupPath, $currentDir)",
                "files": {
                    "highPolyMeshFile": "sourceMeshFile"
                }
            },
            "success": "'decimate-meshlab'",
            "failure": "$failure"
        },
        "decimate-meshlab": {
            "task": "DecimateMesh",
            "description": "Decimate mesh using Meshlab",
            "pre": {
                "decimatedMeshFile": "baseMeshName & '-decimated-meshlab.obj'",
                "deliverables": {
                    "inspectionReport": "inspectMesh ? outputFileBaseName & '-inspection.json' : ''"
                }
            },
            "parameters": {
                "inputMeshFile": "sourceMeshFile",
                "outputMeshFile": "decimatedMeshFile",
                "numFaces": "numFaces",
                "cleanup": "cleanupMesh",
                "preserveTopology": true,
                "preserveBoundaries": true,
                "preserveTexCoords": false,
                "computeVertexNormals": "tangentSpaceNormals",
                "inspectMesh": "deliverables.inspectionReport"
            },
            "success": "'unwrap-rizom'",
            "failure": "'decimate-rapid'"
        },
        "unwrap-rizom": {
            "task": "UnwrapMesh",
            "description": "Unwrap mesh using RizomUV",
            "pre": {
                "deliverables": {
                    "unwrappedMeshObj": "baseMeshName & '-unwrapped.obj'",
                    "unwrappedMeshFbx": "baseMeshName & '-unwrapped.fbx'"
                }
            },
            "parameters": {
                "inputMeshFile": "decimatedMeshFile",
                "outputMeshFile": "deliverables.unwrappedMeshObj",
                "saveFbx": true,
                "saveObj": true,
                "mapSize": "mapSize",
                "segmentationStrength": "segmentationStrength",
                "packEffort": "packEffort"
            },
            "success": "'delivery'",
            "failure": "$failure"
        },
        "delivery": {
            "task": "Delivery",
            "description": "Send result files back to client",
            "parameters": {
                "method": "transportMethod",
                "path": "$firstTrue(deliveryPath, pickupPath, $currentDir)",
                "files": "deliverables"
            },
            "success": "$success",
            "failure": "$failure"
        }
    }
}