{
    "id": "08ac51c5-5fef-47a1-b04b-b02577d6418c",
    "name": "clean",
    "description": "Clean mesh of common issues",
    "version": "1",
    "start": "pickup",

    "parameterSchema": {
        "type": "object",
        "properties": {
            "sourceMeshFile": {
                "type": "string",
                "minLength": 1,
                "format": "file"
            },
            "outputFileBaseName": {
                "type": "string",
                "minLength": 1
            },
            "sourceDiffuseMapFile": {
                "type": "string",
                "minLength": 1,
                "format": "file"
            },
            "sourceMTLFile": {
                "type": "string",
                "minLength": 1,
                "format": "file"
            }
        },
        "required": [
            "sourceMeshFile"
        ],
        "advanced": [
            
        ],
        "additionalProperties": false
    },

    "steps": {
        "pickup": {
            "task": "Pickup",
            "description": "Fetch input files from client",
            "pre": {
                "baseMeshName": "$baseName($firstTrue(outputFileBaseName, sourceMeshFile))"
            },
            "parameters": {
                "method": "transportMethod",
                "path": "$firstTrue(pickupPath, $currentDir)",
                "files": {
                    "highPolyMeshFile": "sourceMeshFile"
                }
            },
            "success": "'clean-mesh'",
            "failure": "$failure"
        },
        "clean-mesh": {
            "task": "CleanupMesh",
            "description": "Clean up mesh",
            "pre": {
                "deliverables": {
                    "cleanedMeshFile": "baseMeshName & '-cleaned' & '.obj'"
                }
            },
            "parameters": {
                "inputMeshFile": "sourceMeshFile",
                "outputMeshFile": "deliverables.cleanedMeshFile",
                "timeout": 1200
            },
            "success": "'delivery'",
            "failure": "$failure"
        },
        "delivery": {
            "task": "Delivery",
            "description": "Send result files back to client",
            "parameters": {
                "method": "transportMethod",
                "path": "$firstTrue(deliveryPath, pickupPath, $currentDir)",
                "files": "deliverables"
            },
            "success": "$success",
            "failure": "$failure"
        }
    }
}